### ISSUE TITLE
srs:v3.0-r8 does not use https for http_callback but uses http

### ISSUE THREAD

**Issue by warmanton** [ossrs/srs#2703]
**描述(Description)**

srs:v3.0-r8 does not use https for http_callback but uses http instead

1. SRS版本(Version): `v3.0-r8`
2. SRS的日志如下(Log):
```
[2021-11-02 04:39:23.044][Error][1][115][11] serve error code=4005 : service cycle : rtmp: stream service : check vhost : rtmp: callback on connect : rtmp on_connect https://<my-domain-here>/api/v1/srs/on-connect : http: on_connect failed, client_id=115, url=https://<my-domain-here>/api/v1/srs/on-connect, request={"action":"on_connect","client_id":115,"ip":"192.168.122.1","vhost":"__defaultVhost__","app":"live","tcUrl":"rtmp://192.168.122.188:1935/live","pageUrl":""}, response=<html>
<head><title>301 Moved Permanently</title></head>
<body>
<center><h1>301 Moved Permanently</h1></center>
<hr><center>nginx/1.18.0 (Ubuntu)</center>
</body>
</html>

```
1. SRS的配置如下(Config):
```
listen              1935;
max_connections     1024;   #1000;
srs_log_tank        console;
daemon              off;
#query_latest_version off;
force_grace_quit on;

http_api {
    enabled         on;
    listen          192.168.122.188:1985;
}
http_server {
    enabled         on;
    listen          192.168.122.188:8080;
    dir             ./objs/nginx/html;
}
stats {
    network         0;
    disk            sda sdb xvda xvdb;
}

vhost __defaultVhost__ {
    cluster {
        mode    remote;
        origin  192.168.122.4:1935 192.168.122.200:1935 192.168.122.71:1935 ;
    }
    http_hooks {
        enabled         on;
        on_connect      https://<my-domain-here>/api/v1/srs/on-connect;
        on_close        https://<my-domain-here>/api/v1/srs/on-close;
        on_publish      https://<my-domain-here>/api/v1/srs/on-publish;
        on_unpublish    https://<my-domain-here>/api/v1/srs/on-unpublish;
        on_play         https://<my-domain-here>/api/v1/srs/on-play;
        on_stop         https://<my-domain-here>/api/v1/srs/on-stop;
    }
}

```
I started tcpdump and found that request goes on http (port 80) but not on https (port 443) and got redirect.

```
# tcpdump -n -i enp2s0 'host <my-domain-here> and port 80' -s0 -A
tcpdump: verbose output suppressed, use -v[v]... for full protocol decode
listening on enp2s0, link-type EN10MB (Ethernet), snapshot length 262144 bytes
12:01:59.310579 IP 192.168.77.12.51616 > <my pub ip>.80: Flags [S], seq 353410233, win 64240, options [mss 1460,sackOK,TS val 3672036573 ecr 0,nop,wscale 6], length 0
E..<..@.?.;...M.T&.....P............e..........
............
12:01:59.409058 IP <my pub ip>.80 > 192.168.77.12.51616: Flags [S.], seq 3328102294, ack 353410234, win 65160, options [mss 1460,sackOK,TS val 2970495269 ecr 3672036573,nop,
wscale 7], length 0
E..<..@.:..FT&....M..P...^..........HP.........
..)%........
12:01:59.409383 IP 192.168.77.12.51616 > <my pub ip>.80: Flags [.], ack 1, win 1004, options [nop,nop,TS val 3672036672 ecr 2970495269], length 0
E..4..@.?.;...M.T&.....P.....^......e......
...@..)%
12:01:59.409607 IP 192.168.77.12.51616 > <my pub ip>.80: Flags [P.], seq 1:336, ack 1, win 1004, options [nop,nop,TS val 3672036672 ecr 2970495269], length 335: HTTP: POST /
api/v1/srs/on-connect HTTP/1.1
E.....@.?.:R..M.T&.....P.....^......f......
...@..)%POST /api/v1/srs/on-connect HTTP/1.1
Connection: Keep-Alive
Content-Length: 156
Content-Type: application/json
Host: <my-domain-here>
User-Agent: SRS/3.0.168(OuXuli)

{"action":"on_connect","client_id":118,"ip":"192.168.122.1","vhost":"__defaultVhost__","app":"live","tcUrl":"rtmp://192.168.122.188:1935/live","pageUrl":""}
12:01:59.507032 IP <my pub ip>.80 > 192.168.77.12.51616: Flags [.], ack 336, win 507, options [nop,nop,TS val 2970495367 ecr 3672036672], length 0
E..4.x@.:...T&....M..P...^..... ....q......
..)....@
12:01:59.507166 IP <my pub ip>.80 > 192.168.77.12.51616: Flags [P.], seq 1:418, ack 336, win 507, options [nop,nop,TS val 2970495367 ecr 3672036672], length 417: HTTP: HTTP/
1.1 301 Moved Permanently
E....y@.:..4T&....M..P...^..... ....D......
..)....@HTTP/1.1 301 Moved Permanently
Server: nginx/1.18.0 (Ubuntu)
Date: Tue, 02 Nov 2021 05:01:59 GMT
Content-Type: text/html
Content-Length: 178
Connection: keep-alive
Location: https://<my-domain-here>:443/api/v1/srs/on-connect

<html>
<head><title>301 Moved Permanently</title></head>
<body>
<center><h1>301 Moved Permanently</h1></center>
<hr><center>nginx/1.18.0 (Ubuntu)</center>
</body>
</html>
```

**重现(Replay)**

> 重现Bug的步骤(How to replay bug?)

1. `run srs v3-r8 with config like above`
2. `run tcpdump to see http_hooks`
3. `start stream to srs`

**期望行为(Expect)**

Expected that srs has to use https when configured https (and http if configured http)
This config works with v4.0.X but I want to try  "stable" version.

**Comment by winlinvip** [comment]
HTTPS is feature for SRS 4.0

I will delete this issue.
